{
  "schema": "codexy.efficiency-scorecard.v1",
  "corpusId": "orchestration-1.5-baseline-v1",
  "candidate": {
    "head": "1bc9bde1fb5b2c81920829aca36ce99e2377c568",
    "installedContentSha256": null
  },
  "thresholds": {
    "medianInputTokenReductionMinPct": 25.0,
    "p95ToolOutputByteReductionMinPct": 40.0,
    "maxP0P1Misses": 0,
    "acceptanceMinPct": 95.0,
    "maxRepairCycleIncrease": 0,
    "maxReviewCycleIncrease": 0
  },
  "measureAvailability": {
    "inputTokens": "unavailable",
    "wallTimeMs": "unavailable",
    "observedCostUsd": "unavailable",
    "toolInputBytes": "available",
    "toolOutputBytes": "available",
    "cacheInputTokens": "unavailable"
  },
  "comparisons": [
    {
      "id": "baseline-simple",
      "optimizationId": "program-baseline",
      "optimizationSet": ["program-baseline"],
      "model": "gpt-5.6-sol",
      "effort": "high",
      "taskId": "simple-discovery",
      "taskClass": "simple-discovery",
      "owner": {
        "kind": "root",
        "id": "baseline-root"
      },
      "phase": "discovery",
      "window": {
        "kind": "equal-record-count",
        "beforeRecords": 3,
        "afterRecords": 3
      },
      "before": {
        "acceptanceRuns": 1,
        "acceptedRuns": 1,
        "p0P1Misses": 0,
        "proofCompleteRuns": 1,
        "repairs": 0,
        "reviewCycles": 0,
        "inputTokens": null,
        "wallTimeMs": null,
        "observedCostUsd": null,
        "toolInputBytes": 0,
        "toolOutputBytes": 0,
        "cacheInputTokens": null
      },
      "after": {
        "acceptanceRuns": 1,
        "acceptedRuns": 1,
        "p0P1Misses": 0,
        "proofCompleteRuns": 1,
        "repairs": 0,
        "reviewCycles": 0,
        "inputTokens": null,
        "wallTimeMs": null,
        "observedCostUsd": null,
        "toolInputBytes": 0,
        "toolOutputBytes": 0,
        "cacheInputTokens": null
      }
    },
    {
      "id": "baseline-general",
      "optimizationId": "program-baseline",
      "optimizationSet": ["program-baseline"],
      "model": "gpt-5.6-sol",
      "effort": "high",
      "taskId": "general-implementation",
      "taskClass": "general-implementation",
      "owner": {
        "kind": "child",
        "id": "baseline-child"
      },
      "phase": "implementation",
      "window": {
        "kind": "equal-record-count",
        "beforeRecords": 3,
        "afterRecords": 3
      },
      "before": {
        "acceptanceRuns": 1,
        "acceptedRuns": 1,
        "p0P1Misses": 0,
        "proofCompleteRuns": 1,
        "repairs": 0,
        "reviewCycles": 1,
        "inputTokens": null,
        "wallTimeMs": null,
        "observedCostUsd": null,
        "toolInputBytes": 0,
        "toolOutputBytes": 0,
        "cacheInputTokens": null
      },
      "after": {
        "acceptanceRuns": 1,
        "acceptedRuns": 1,
        "p0P1Misses": 0,
        "proofCompleteRuns": 1,
        "repairs": 0,
        "reviewCycles": 1,
        "inputTokens": null,
        "wallTimeMs": null,
        "observedCostUsd": null,
        "toolInputBytes": 0,
        "toolOutputBytes": 0,
        "cacheInputTokens": null
      }
    },
    {
      "id": "baseline-review",
      "optimizationId": "program-baseline",
      "optimizationSet": ["program-baseline"],
      "model": "gpt-5.6-sol",
      "effort": "high",
      "taskId": "review-response",
      "taskClass": "review-response",
      "owner": {
        "kind": "selected-reviewer",
        "id": "baseline-reviewer"
      },
      "phase": "review-response",
      "window": {
        "kind": "equal-record-count",
        "beforeRecords": 3,
        "afterRecords": 3
      },
      "before": {
        "acceptanceRuns": 1,
        "acceptedRuns": 1,
        "p0P1Misses": 0,
        "proofCompleteRuns": 1,
        "repairs": 0,
        "reviewCycles": 1,
        "inputTokens": null,
        "wallTimeMs": null,
        "observedCostUsd": null,
        "toolInputBytes": 0,
        "toolOutputBytes": 0,
        "cacheInputTokens": null
      },
      "after": {
        "acceptanceRuns": 1,
        "acceptedRuns": 1,
        "p0P1Misses": 0,
        "proofCompleteRuns": 1,
        "repairs": 0,
        "reviewCycles": 1,
        "inputTokens": null,
        "wallTimeMs": null,
        "observedCostUsd": null,
        "toolInputBytes": 0,
        "toolOutputBytes": 0,
        "cacheInputTokens": null
      }
    },
    {
      "id": "baseline-strict",
      "optimizationId": "program-baseline",
      "optimizationSet": ["program-baseline"],
      "model": "gpt-5.6-sol",
      "effort": "high",
      "taskId": "strict-work",
      "taskClass": "strict-work",
      "owner": {
        "kind": "root",
        "id": "baseline-root"
      },
      "phase": "strict-work",
      "window": {
        "kind": "equal-record-count",
        "beforeRecords": 3,
        "afterRecords": 3
      },
      "before": {
        "acceptanceRuns": 1,
        "acceptedRuns": 1,
        "p0P1Misses": 0,
        "proofCompleteRuns": 1,
        "repairs": 0,
        "reviewCycles": 1,
        "inputTokens": null,
        "wallTimeMs": null,
        "observedCostUsd": null,
        "toolInputBytes": 0,
        "toolOutputBytes": 0,
        "cacheInputTokens": null
      },
      "after": {
        "acceptanceRuns": 1,
        "acceptedRuns": 1,
        "p0P1Misses": 0,
        "proofCompleteRuns": 1,
        "repairs": 0,
        "reviewCycles": 1,
        "inputTokens": null,
        "wallTimeMs": null,
        "observedCostUsd": null,
        "toolInputBytes": 0,
        "toolOutputBytes": 0,
        "cacheInputTokens": null
      }
    },
    {
      "id": "baseline-compaction",
      "optimizationId": "program-baseline",
      "optimizationSet": ["program-baseline"],
      "model": "gpt-5.6-sol",
      "effort": "high",
      "taskId": "compaction-recovery",
      "taskClass": "compaction-recovery",
      "owner": {
        "kind": "child",
        "id": "baseline-child"
      },
      "phase": "compaction-recovery",
      "window": {
        "kind": "equal-record-count",
        "beforeRecords": 3,
        "afterRecords": 3
      },
      "before": {
        "acceptanceRuns": 1,
        "acceptedRuns": 1,
        "p0P1Misses": 0,
        "proofCompleteRuns": 1,
        "repairs": 0,
        "reviewCycles": 0,
        "inputTokens": null,
        "wallTimeMs": null,
        "observedCostUsd": null,
        "toolInputBytes": 0,
        "toolOutputBytes": 0,
        "cacheInputTokens": null
      },
      "after": {
        "acceptanceRuns": 1,
        "acceptedRuns": 1,
        "p0P1Misses": 0,
        "proofCompleteRuns": 1,
        "repairs": 0,
        "reviewCycles": 0,
        "inputTokens": null,
        "wallTimeMs": null,
        "observedCostUsd": null,
        "toolInputBytes": 0,
        "toolOutputBytes": 0,
        "cacheInputTokens": null
      }
    },
    {
      "id": "baseline-wait",
      "optimizationId": "program-baseline",
      "optimizationSet": ["program-baseline"],
      "model": "gpt-5.6-sol",
      "effort": "high",
      "taskId": "general-implementation",
      "taskClass": "general-implementation",
      "owner": { "kind": "child", "id": "baseline-child" },
      "phase": "wait",
      "window": { "kind": "equal-record-count", "beforeRecords": 3, "afterRecords": 3 },
      "before": {
        "acceptanceRuns": 1,
        "acceptedRuns": 1,
        "p0P1Misses": 0,
        "proofCompleteRuns": 1,
        "repairs": 0,
        "reviewCycles": 0,
        "inputTokens": null,
        "wallTimeMs": null,
        "observedCostUsd": null,
        "toolInputBytes": 0,
        "toolOutputBytes": 0,
        "cacheInputTokens": null
      },
      "after": {
        "acceptanceRuns": 1,
        "acceptedRuns": 1,
        "p0P1Misses": 0,
        "proofCompleteRuns": 1,
        "repairs": 0,
        "reviewCycles": 0,
        "inputTokens": null,
        "wallTimeMs": null,
        "observedCostUsd": null,
        "toolInputBytes": 0,
        "toolOutputBytes": 0,
        "cacheInputTokens": null
      }
    },
    {
      "id": "baseline-tool-output",
      "optimizationId": "program-baseline",
      "optimizationSet": ["program-baseline"],
      "model": "gpt-5.6-sol",
      "effort": "high",
      "taskId": "review-response",
      "taskClass": "review-response",
      "owner": { "kind": "selected-reviewer", "id": "baseline-reviewer" },
      "phase": "tool-output",
      "window": { "kind": "equal-record-count", "beforeRecords": 3, "afterRecords": 3 },
      "before": {
        "acceptanceRuns": 1,
        "acceptedRuns": 1,
        "p0P1Misses": 0,
        "proofCompleteRuns": 1,
        "repairs": 0,
        "reviewCycles": 0,
        "inputTokens": null,
        "wallTimeMs": null,
        "observedCostUsd": null,
        "toolInputBytes": 0,
        "toolOutputBytes": 0,
        "cacheInputTokens": null
      },
      "after": {
        "acceptanceRuns": 1,
        "acceptedRuns": 1,
        "p0P1Misses": 0,
        "proofCompleteRuns": 1,
        "repairs": 0,
        "reviewCycles": 0,
        "inputTokens": null,
        "wallTimeMs": null,
        "observedCostUsd": null,
        "toolInputBytes": 0,
        "toolOutputBytes": 0,
        "cacheInputTokens": null
      }
    }
  ],
  "decisionInputs": [
    {
      "optimizationId": "program-baseline",
      "comparisonIds": [
        "baseline-simple",
        "baseline-general",
        "baseline-review",
        "baseline-strict",
        "baseline-compaction",
        "baseline-wait",
        "baseline-tool-output"
      ],
      "evidenceState": "unobservable",
      "unavailableMeasures": [
        "inputTokens",
        "wallTimeMs",
        "observedCostUsd",
        "cacheInputTokens"
      ]
    }
  ]
}
